{
  "schema_version": 1,
  "campaign_id": "aquila-001",
  "revision": 9,
  "last_event_id": "event-000009",
  "updated_at": "2026-10-21T16:40:20.602Z",
  "phase": "playing",
  "session": 1,
  "game_time": {
    "day": 1,
    "phase": 2,
    "label": "Tag 1, späterer Vormittag; zweite parallele Reisephase, beide im Verteilerhaus"
  },
  "scene_id": "scene-06",
  "location_id": "loc-distributor",
  "present_npc_ids": [],
  "settings": {
    "dice_mode": "tool",
    "fantasy": "ambiguous",
    "tone": "Entdeckungsabenteuer; unblutige Gefahren; gleichberechtigte Helden"
  },
  "characters": [
    {
      "id": "pc-1",
      "player_id": "player-1",
      "name": "Cäsar",
      "role_id": "speaker",
      "attributes": {
        "strength": 0,
        "agility": 1,
        "wit": 1,
        "heart": 2
      },
      "courage": 4,
      "luck": 2,
      "advancement": 1,
      "talent_used": false,
      "rally_used": false,
      "equipment": [
        {
          "name": "Wasserflasche",
          "slots": 1,
          "item_id": null
        },
        {
          "name": "Reiseproviant",
          "slots": 1,
          "item_id": null
        },
        {
          "name": "Wachstafel und Griffel",
          "slots": 1,
          "item_id": null
        },
        {
          "name": "Reisemantel",
          "slots": 1,
          "item_id": null
        },
        {
          "name": "Leih-Brieftaube 1 mit Transportkorb und Zetteln",
          "slots": 1,
          "item_id": "item-pigeon-1"
        },
        {
          "name": "Leih-Brieftaube 2 mit Transportkorb und Zetteln",
          "slots": 1,
          "item_id": "item-pigeon-2"
        }
      ],
      "personal_goal": null,
      "conditions": []
    },
    {
      "id": "pc-2",
      "player_id": "player-2",
      "name": "Augustus",
      "role_id": "guardian",
      "attributes": {
        "strength": 2,
        "agility": 1,
        "wit": 0,
        "heart": 1
      },
      "courage": 4,
      "luck": 2,
      "advancement": 1,
      "talent_used": false,
      "rally_used": false,
      "equipment": [
        {
          "name": "Wasserflasche",
          "slots": 1,
          "item_id": null
        },
        {
          "name": "Reiseproviant",
          "slots": 1,
          "item_id": null
        },
        {
          "name": "Kleiner Schild",
          "slots": 1,
          "item_id": null
        },
        {
          "name": "Übungsstab",
          "slots": 1,
          "item_id": null
        },
        {
          "name": "Leerer Transportkorb mit Nachrichtenzetteln",
          "slots": 1,
          "item_id": null
        },
        {
          "name": "Leih-Brieftaube 4 mit Transportkorb und Zetteln",
          "slots": 1,
          "item_id": "item-pigeon-4"
        }
      ],
      "personal_goal": null,
      "conditions": []
    }
  ],
  "party": {
    "bond": "Cäsar und Augustus kennen sich aus dem Rednerstudium. Augustus musste das Studium abbrechen, weil er nicht so gut darin war.",
    "coins": 12,
    "starting_resources_granted": true,
    "item_ids": []
  },
  "known_clues": [
    {
      "clue_id": "clue-sand",
      "discovered_event_id": "event-000002",
      "known_by": [
        "pc-1",
        "pc-2"
      ],
      "revealed_text": "Beim Versiegen des Adlerbrunnens trat roter Sand aus. Livia zeigt ihn beiden und sagt, sie kenne solchen Sand vom alten Steinbruch, während an der Morgenquelle heller Fels liege. Wie der Sand in den Brunnen kam und ob der Steinbruch mit dem Ausfall zusammenhängt, ist unklar.",
      "interpretation": "observation"
    },
    {
      "clue_id": "clue-note",
      "discovered_event_id": "event-000005",
      "known_by": [
        "pc-1",
        "pc-2"
      ],
      "revealed_text": "Livia berichtet mündlich, Neria habe gestern Abend einen alten Wasserabzweig beim Steinbruch prüfen wollen und sei noch nicht zurück. Die schriftliche Notiz wurde weder gezeigt noch gelesen; ihr weiterer Inhalt ist unbekannt.",
      "interpretation": "observation"
    },
    {
      "clue_id": "clue-flow",
      "discovered_event_id": "event-000006",
      "known_by": [
        "pc-1",
        "pc-2"
      ],
      "revealed_text": "Beide sehen im Verteilerhaus einen laufenden klaren Zufluss durch den offenen QUELLE-Schieber. Trotz Zufluss ist die Stadtleitung trocken. Frühere Einzelbeobachtungen bleiben im Eventlog dokumentiert.",
      "interpretation": "confirmed"
    },
    {
      "clue_id": "clue-diversion",
      "discovered_event_id": "event-000006",
      "known_by": [
        "pc-1",
        "pc-2"
      ],
      "revealed_text": "Beide sehen den Wasserweg und die beschrifteten Schieber im Verteilerhaus: QUELLE offen, STADT geschlossen, RESERVE offen und mit frischem Holzkeil blockiert. Das Wasser fließt ins Steinbruchbecken statt zur Stadt. Verantwortlicher unbekannt.",
      "interpretation": "confirmed"
    },
    {
      "clue_id": "clue-neria",
      "discovered_event_id": "event-000007",
      "known_by": [
        "pc-2"
      ],
      "revealed_text": "Neria identifiziert sich gegenüber Augustus. Nach Stegbruch sitzt sie mit schmerzendem Knöchel sicher im trockenen Wartungsraum fest. Sie sagt, jemand habe Schieber verstellt, sodass Wasser ins Steinbruchbecken statt zur Stadt laufe; heute früh habe sie Wagen am Becken gehört. Kein Tätername genannt. Augustus hat sie anschließend sicher befreit. Sie sitzt nun im Steinbruch neben der Mauer; der Knöchel schmerzt weiter. Sie nennt das Verteilerhaus als Ort der Schieber und bietet eine Wegbeschreibung an.",
      "interpretation": "observation"
    }
  ],
  "party_hypotheses": [],
  "npc_states": [
    {
      "npc_id": "npc-livia",
      "attitude": "open",
      "location_id": "loc-workshop",
      "notes": "GM: Während der Reise erreicht Leih-Taube 3 den Werkstattschlag. Livia liest Augustus' Bitte um Abholung der geretteten, gehbehinderten Neria am Steinbruchbecken und beginnt Transporthilfe zu organisieren. Noch keine Abholung und keine Empfangsbestätigung an Helden. Vogel 3 im Werkstattschlag, Korb blieb bei Augustus."
    },
    {
      "npc_id": "npc-neria",
      "attitude": "trusted",
      "location_id": "loc-quarry",
      "notes": "Wartet sicher neben Mauer am Steinbruchbecken. Augustus hat ausdrücklich Abholung per Taube angefordert und nach ihrer Erklärung einen äußeren Wartungspfad zum Verteilerhaus genommen. Knöchel schmerzt weiterhin; Abholung noch nicht erfolgt."
    },
    {
      "npc_id": "npc-marcellus",
      "attitude": "distant",
      "location_id": "loc-harbor",
      "notes": "Vorbereiteter Ausgangszustand; der Gruppe noch nicht begegnet."
    },
    {
      "npc_id": "npc-sextus",
      "attitude": "neutral",
      "location_id": "loc-harbor",
      "notes": "Vorbereiteter Ausgangszustand; der Gruppe noch nicht begegnet."
    },
    {
      "npc_id": "npc-publius",
      "attitude": "neutral",
      "location_id": "loc-harbor",
      "notes": "Vorbereiteter Ausgangszustand; der Gruppe noch nicht begegnet."
    },
    {
      "npc_id": "npc-cassia",
      "attitude": "neutral",
      "location_id": "loc-forum",
      "notes": "Vorbereiteter Ausgangszustand; der Gruppe noch nicht begegnet."
    },
    {
      "npc_id": "npc-bato",
      "attitude": "open",
      "location_id": "loc-forum",
      "notes": "Cäsar äußert Zuversicht in Augustus und schlägt bei Bedarf den Fluss vor. Der Bäcker erwägt das als Notbehelf, braucht dafür aber einen Wagen. Noch kein Wagen besorgt, kein Abtransport und kein neuer Auftrag der Helden. Sein Name noch unbekannt. Hat mit Livia nach deren Leihgabe die Brunnenabdeckung wieder eingesetzt; bleibt am Forum."
    },
    {
      "npc_id": "npc-flavia",
      "attitude": "open",
      "location_id": "loc-baths",
      "notes": "Vorbereiteter Ausgangszustand; der Gruppe noch nicht begegnet."
    },
    {
      "npc_id": "npc-gatekeeper",
      "attitude": "neutral",
      "location_id": "loc-gate",
      "notes": "Ist nach Cäsars Inspektion am Mühlentor geblieben. Hat den Wartungsweg gezeigt, aber keine zusätzliche Begleitung oder Ermittlungen übernommen."
    }
  ],
  "world_changes": [
    {
      "id": "change-000003-crowd",
      "text": "Cäsar hat die Aufmerksamkeit mehrerer naher Schaulustiger gewonnen. Augustus und Livia haben vorübergehend Platz an der Abdeckung. Keine dauerhafte Ablenkung garantiert.",
      "source_event_id": "event-000003",
      "visibility": "public",
      "key": "crowd-distracted",
      "value": true
    },
    {
      "id": "change-000003-cover",
      "text": "Livia hat zwei Griffmulden an der Brunnenabdeckung gezeigt. Sie bietet gemeinsames Anheben und Ablegen an. Die Platte ist noch geschlossen.",
      "source_event_id": "event-000003",
      "visibility": "public",
      "key": "fountain-cover-open",
      "value": false
    },
    {
      "id": "change-000004-cover",
      "text": "Augustus und Livia haben die Steinabdeckung gemeinsam sicher neben der Öffnung abgelegt. Der schmale Wartungseinlauf ist zugänglich.",
      "source_event_id": "event-000004",
      "visibility": "public",
      "key": "fountain-cover-open",
      "value": true
    },
    {
      "id": "change-000004-inlet",
      "text": "Im geöffneten Bereich ist keine Verstopfung sichtbar. Die Rinne ist noch feucht, doch aus der Zuleitung kommt kein frisches Wasser. Die genaue Ursache ist unbekannt.",
      "source_event_id": "event-000004",
      "visibility": "public",
      "key": "fountain-inlet-flow",
      "value": false
    },
    {
      "id": "change-000005-route",
      "text": "Livia erläutert beiden den regulären Wasserweg: Morgenquelle, Aquädukt, Kontrolle beim Mühlentor, Stadtleitungen. Mühlentor etwa 30 Minuten vom Forum; Steinbruch über Hafen insgesamt etwa 45 Minuten. Noch keine Reise und keine Verbindung zur aktuellen Ursache bewiesen.",
      "source_event_id": "event-000005",
      "visibility": "public",
      "key": "water-route-known",
      "value": true
    },